,block_id,timeout_in_s,solver_time_in_sec,has_model,finished_execution,lower_bound,upper_bound,models_found,cost_per_model_found,found_model_times,hard_is_sat,hard_time_in_sec,hard_found_model,hard_cost_found
21,0x1E77fbE7bfe9b11c75b90A76f571dca0C6D70a9a_Ownable_initial_block2.0,20.0,5.51,True,True,0,16,"['PUSH PUSH PUSH SWAP1 SLOAD_0 AND_0 SWAP2 SWAP1 POP POP CALLER_0 OR_0 PUSH SSTORE_0 CALLER_0 PUSH PUSH CALLER_0 SWAP2 PUSH MLOAD_0 PUSH SWAP1', 'PUSH PUSH PUSH SWAP1 SLOAD_0 AND_0 SWAP2 SWAP1 POP POP CALLER_0 OR_0 PUSH SSTORE_0 CALLER_0 PUSH PUSH CALLER_0 SWAP2 PUSH MLOAD_0 PUSH SWAP1', 'POP PUSH PUSH CALLER_0 SWAP2 SLOAD_0 AND_0 PUSH SWAP1 CALLER_0 PUSH SWAP1 SWAP1 SWAP2 CALLER_0 OR_0 PUSH SSTORE_0 SWAP3 SWAP2 PUSH PUSH MLOAD_0', 'POP CALLER_0 PUSH PUSH SLOAD_0 AND_0 OR_0 PUSH SSTORE_0 CALLER_0 CALLER_0 PUSH PUSH PUSH PUSH MLOAD_0 NOP NOP NOP NOP NOP NOP NOP', 'POP PUSH SLOAD_0 PUSH AND_0 CALLER_0 OR_0 PUSH SSTORE_0 CALLER_0 CALLER_0 PUSH PUSH DUP2 PUSH MLOAD_0 NOP NOP NOP NOP NOP NOP NOP', 'POP CALLER_0 PUSH SLOAD_0 PUSH AND_0 DUP2 OR_0 PUSH SSTORE_0 CALLER_0 PUSH PUSH PUSH PUSH MLOAD_0 NOP NOP NOP NOP NOP NOP NOP', 'POP CALLER_0 PUSH PUSH SLOAD_0 AND_0 DUP2 OR_0 PUSH SSTORE_0 CALLER_0 PUSH PUSH PUSH PUSH MLOAD_0 NOP NOP NOP NOP NOP NOP NOP', 'POP CALLER_0 DUP1 PUSH SLOAD_0 PUSH AND_0 OR_0 PUSH SSTORE_0 DUP1 PUSH PUSH DUP2 PUSH MLOAD_0 NOP NOP NOP NOP NOP NOP NOP']","[0, 0, 0, 7, 7, 7, 7, 7]","[0.74, 0.74, 1.45, 1.54, 1.67, 3.97, 4.06, 5.52]",True,6.04,POP CALLER_0 DUP1 PUSH PUSH SLOAD_0 AND_0 OR_0 DUP1 PUSH MLOAD_0 SWAP1 POP PUSH SWAP2 PUSH CALLER_0 SWAP4 SWAP2 DUP2 SSTORE_0 DUP1 SWAP3,0.0
22,0x1d29Bafa88E83a6D8F757DbFAf8BAf7be8fE08Bf_LoveVote_block184,50.0,7.37,True,True,0,19,"['PUSH PUSH SWAP1 DUP5 PUSH MSTORE_1 KECCAK256_0 PUSH DUP3 LT_0 DUP4 PUSH MSTORE_3 PUSH PUSH MSTORE_0 DUP2 PUSH MSTORE_2 DUP3 SWAP1', 'PUSH PUSH SWAP1 DUP5 PUSH MSTORE_1 KECCAK256_0 PUSH DUP3 LT_0 DUP4 PUSH MSTORE_3 PUSH PUSH MSTORE_0 DUP2 PUSH MSTORE_2 DUP3 SWAP1', 'DUP2 PUSH DUP5 PUSH MSTORE_1 MSTORE_3 PUSH PUSH MSTORE_0 PUSH PUSH KECCAK256_0 SWAP2 SWAP2 DUP1 PUSH MSTORE_2 DUP2 PUSH DUP4 LT_0', 'PUSH PUSH MSTORE_0 PUSH PUSH DUP5 PUSH MSTORE_1 KECCAK256_0 PUSH DUP2 PUSH MSTORE_2 DUP4 DUP4 SWAP2 MSTORE_3 PUSH DUP4 LT_0 NOP', 'PUSH PUSH DUP5 PUSH MSTORE_1 MSTORE_0 DUP2 PUSH MSTORE_3 PUSH PUSH KECCAK256_0 DUP1 PUSH MSTORE_2 DUP2 PUSH DUP2 LT_0 NOP NOP', 'PUSH PUSH MSTORE_0 DUP2 PUSH DUP5 DUP2 MSTORE_1 MSTORE_3 PUSH PUSH KECCAK256_0 DUP1 PUSH MSTORE_2 DUP2 PUSH DUP2 LT_0 NOP NOP', 'PUSH PUSH MSTORE_0 DUP2 PUSH DUP5 PUSH MSTORE_1 MSTORE_3 PUSH PUSH KECCAK256_0 DUP1 PUSH MSTORE_2 DUP2 PUSH DUP4 LT_0 NOP NOP', 'DUP3 PUSH MSTORE_1 PUSH PUSH MSTORE_0 DUP2 PUSH MSTORE_3 PUSH PUSH KECCAK256_0 DUP1 PUSH MSTORE_2 DUP2 PUSH DUP4 LT_0 NOP NOP', 'PUSH PUSH DUP5 PUSH MSTORE_1 MSTORE_0 DUP2 PUSH MSTORE_3 PUSH PUSH KECCAK256_0 DUP1 PUSH MSTORE_2 DUP2 PUSH DUP2 LT_0 NOP NOP', 'DUP2 DUP4 PUSH PUSH MSTORE_0 PUSH MSTORE_1 PUSH MSTORE_3 PUSH PUSH KECCAK256_0 DUP1 PUSH MSTORE_2 DUP2 PUSH DUP2 LT_0 NOP NOP', 'PUSH PUSH DUP5 PUSH MSTORE_1 MSTORE_0 DUP2 PUSH MSTORE_3 PUSH PUSH KECCAK256_0 DUP1 PUSH MSTORE_2 DUP2 PUSH DUP2 LT_0 NOP NOP']","[0, 0, 0, 1, 2, 2, 2, 2, 2, 2, 2]","[3.09, 3.09, 3.36, 4.68, 5.97, 6.58, 7.12, 7.14, 7.33, 7.35, 7.38]",True,4.54,PUSH PUSH KECCAK256_0 DUP1 PUSH PUSH MSTORE_0 PUSH MSTORE_2 DUP2 SWAP2 DUP5 PUSH MSTORE_1 SWAP2 DUP4 PUSH MSTORE_3 PUSH DUP4 LT_0,0.0
23,0x1d29Bafa88E83a6D8F757DbFAf8BAf7be8fE08Bf_LoveVote_block20,40.0,50.07,True,False,-18,22,"['PUSH CALLER_0 PUSH MSTORE_0 POP PUSH PUSH SWAP1 KECCAK256_0 PUSH DUP2 DUP1 SLOAD_0 PUSH PUSH MSTORE_1 PUSH AND_0 CALLER_0 SWAP1 OR_0 DUP2 SSTORE_0 ADD_0 SLOAD_1 PUSHTAG_0 SWAP1', 'PUSH CALLER_0 PUSH MSTORE_0 POP PUSH PUSH SWAP1 KECCAK256_0 PUSH DUP2 DUP1 SLOAD_0 PUSH PUSH MSTORE_1 PUSH AND_0 CALLER_0 SWAP1 OR_0 DUP2 SSTORE_0 ADD_0 SLOAD_1 PUSHTAG_0 SWAP1', 'PUSH PUSH KECCAK256_0 PUSH DUP2 SLOAD_0 AND_0 CALLER_0 OR_0 PUSH CALLER_0 PUSH PUSHTAG_0 SWAP4 DUP6 SSTORE_0 SWAP2 PUSH DUP6 ADD_0 SWAP3 MSTORE_1 PUSH MSTORE_0 SLOAD_1 NOP NOP', 'PUSH PUSH KECCAK256_0 CALLER_0 PUSH DUP3 SLOAD_0 AND_0 SWAP2 SWAP2 OR_0 CALLER_0 PUSH MSTORE_0 DUP2 SSTORE_0 PUSHTAG_0 PUSH PUSH MSTORE_1 PUSH DUP3 ADD_0 SLOAD_1 NOP NOP NOP', 'PUSH PUSH KECCAK256_0 PUSHTAG_0 DUP2 PUSH PUSH PUSH CALLER_0 PUSH MSTORE_0 MSTORE_1 ADD_0 CALLER_0 DUP4 SLOAD_0 PUSH AND_0 OR_0 DUP4 SSTORE_0 SLOAD_1 NOP NOP NOP NOP NOP', 'PUSH PUSH KECCAK256_0 CALLER_0 PUSH PUSH PUSH DUP5 SLOAD_0 PUSH AND_0 DUP5 OR_0 DUP6 SSTORE_0 MSTORE_1 MSTORE_0 PUSHTAG_0 PUSH DUP3 ADD_0 SLOAD_1 NOP NOP NOP NOP NOP', 'PUSH PUSH KECCAK256_0 PUSH CALLER_0 PUSH MSTORE_0 DUP2 SLOAD_0 AND_0 CALLER_0 OR_0 DUP2 SSTORE_0 PUSH PUSH MSTORE_1 PUSHTAG_0 DUP2 PUSH ADD_0 SLOAD_1 NOP NOP NOP NOP NOP', 'PUSH PUSH KECCAK256_0 PUSH CALLER_0 PUSH MSTORE_0 DUP2 SLOAD_0 AND_0 CALLER_0 OR_0 DUP2 SSTORE_0 PUSH PUSH MSTORE_1 PUSHTAG_0 DUP2 PUSH ADD_0 SLOAD_1 NOP NOP NOP NOP NOP', 'PUSH PUSH KECCAK256_0 PUSH CALLER_0 PUSH MSTORE_0 DUP2 SLOAD_0 AND_0 CALLER_0 OR_0 DUP2 SSTORE_0 PUSH PUSH MSTORE_1 PUSHTAG_0 DUP2 PUSH ADD_0 SLOAD_1 NOP NOP NOP NOP NOP']","[0, 0, 2, 3, 5, 5, 5, 5, 5]","[10.3, 10.31, 14.84, 15.67, 35.89, 49.69, 50.01, 50.04, 50.06]",True,13.73,PUSH PUSH KECCAK256_0 PUSH DUP2 SLOAD_0 AND_0 PUSH DUP3 PUSHTAG_0 SWAP3 PUSH SWAP3 SWAP1 SWAP1 PUSH CALLER_0 SWAP2 MSTORE_1 OR_0 DUP2 SSTORE_0 CALLER_0 PUSH MSTORE_0 ADD_0 SLOAD_1,0.0
24,0x1d29Bafa88E83a6D8F757DbFAf8BAf7be8fE08Bf_LoveVote_block78,50.0,8.72,True,True,0,19,"['PUSH PUSH MSTORE_0 PUSH PUSH KECCAK256_0 DUP4 PUSH MSTORE_1 SWAP1 SWAP1 DUP3 PUSH MSTORE_3 DUP1 PUSH MSTORE_2 DUP2 PUSH DUP4 LT_0', 'PUSH PUSH MSTORE_0 PUSH PUSH KECCAK256_0 DUP4 PUSH MSTORE_1 SWAP1 SWAP1 DUP3 PUSH MSTORE_3 DUP1 PUSH MSTORE_2 DUP2 PUSH DUP4 LT_0', 'DUP3 PUSH MSTORE_1 DUP2 PUSH MSTORE_3 PUSH PUSH SWAP1 KECCAK256_0 PUSH DUP3 LT_0 PUSH PUSH MSTORE_0 DUP2 PUSH MSTORE_2 DUP3 SWAP1', 'PUSH PUSH KECCAK256_0 PUSH DUP5 PUSH MSTORE_1 PUSH MSTORE_0 DUP1 PUSH MSTORE_2 PUSH DUP3 SWAP3 LT_0 DUP4 PUSH MSTORE_3 DUP3 SWAP1', 'PUSH PUSH DUP5 DUP2 MSTORE_1 PUSH PUSH MSTORE_0 KECCAK256_0 DUP3 PUSH MSTORE_3 PUSH DUP2 PUSH MSTORE_2 DUP3 LT_0 SWAP2 DUP1 SWAP3', 'PUSH DUP4 PUSH MSTORE_1 PUSH PUSH PUSH MSTORE_0 KECCAK256_0 DUP3 DUP2 PUSH MSTORE_2 PUSH MSTORE_3 PUSH DUP3 LT_0 DUP3 SWAP1 NOP', 'DUP3 PUSH MSTORE_1 DUP2 PUSH MSTORE_3 PUSH PUSH PUSH MSTORE_0 PUSH KECCAK256_0 DUP2 DUP2 PUSH MSTORE_2 PUSH DUP4 LT_0 NOP NOP', 'DUP3 PUSH MSTORE_1 PUSH DUP3 PUSH MSTORE_3 PUSH MSTORE_0 PUSH PUSH KECCAK256_0 DUP1 PUSH MSTORE_2 DUP2 PUSH DUP4 LT_0 NOP NOP', 'PUSH DUP4 PUSH MSTORE_1 DUP3 PUSH MSTORE_3 PUSH KECCAK256_0 DUP1 PUSH PUSH MSTORE_0 PUSH MSTORE_2 DUP2 PUSH DUP4 LT_0 NOP NOP', 'DUP2 DUP4 PUSH MSTORE_1 PUSH MSTORE_3 PUSH PUSH MSTORE_0 PUSH PUSH KECCAK256_0 DUP1 PUSH MSTORE_2 DUP2 PUSH DUP2 LT_0 NOP NOP']","[0, 0, 0, 0, 0, 1, 2, 2, 2, 2]","[2.95, 2.96, 4.53, 5.37, 5.54, 6.14, 7.7, 7.78, 7.91, 8.74]",True,3.72,PUSH PUSH DUP5 PUSH MSTORE_1 MSTORE_0 PUSH DUP2 LT_0 PUSH PUSH KECCAK256_0 SWAP1 DUP2 PUSH MSTORE_2 DUP4 PUSH MSTORE_3 DUP3 SWAP1,0.0
25,0x1f2cF791d940Bbb9fbe777271afa6ff9bBA8AbA0_ERC20_block7,60.0,55.48,True,True,0,27,"['PUSH MLOAD_0 PUSH PUSH DUP3 MSTORE_0 PUSH DUP3 ADD_4 PUSH DUP4 PUSH ADD_2 MSTORE_1 PUSH DUP4 PUSH ADD_3 MSTORE_2 MSTORE_3 PUSH PUSH DUP3 ADD_1 MSTORE_4 PUSH ADD_0', 'PUSH MLOAD_0 PUSH PUSH DUP3 MSTORE_0 PUSH DUP3 ADD_4 PUSH DUP4 PUSH ADD_2 MSTORE_1 PUSH DUP4 PUSH ADD_3 MSTORE_2 MSTORE_3 PUSH PUSH DUP3 ADD_1 MSTORE_4 PUSH ADD_0', 'PUSH MLOAD_0 PUSH PUSH DUP3 MSTORE_0 PUSH PUSH PUSH DUP5 ADD_2 MSTORE_1 DUP3 ADD_3 MSTORE_2 PUSH PUSH DUP3 ADD_4 MSTORE_3 PUSH PUSH DUP3 ADD_1 MSTORE_4 PUSH ADD_0', 'PUSH MLOAD_0 PUSH PUSH PUSH DUP4 ADD_2 PUSH DUP5 MSTORE_0 MSTORE_1 PUSH DUP3 ADD_1 PUSH DUP4 PUSH ADD_3 MSTORE_2 PUSH PUSH DUP5 ADD_4 MSTORE_3 MSTORE_4 PUSH ADD_0', 'PUSH MLOAD_0 PUSH DUP2 PUSH ADD_3 PUSH PUSH DUP5 MSTORE_0 DUP4 PUSH ADD_2 MSTORE_1 MSTORE_2 PUSH PUSH PUSH DUP4 ADD_4 MSTORE_3 PUSH DUP3 ADD_1 MSTORE_4 PUSH ADD_0']","[0, 0, 0, 0, 0]","[20.46, 20.46, 42.43, 48.4, 55.49]",True,15.37,PUSH MLOAD_0 PUSH DUP2 PUSH ADD_4 PUSH DUP4 MSTORE_0 PUSH DUP4 PUSH ADD_2 MSTORE_1 PUSH DUP4 PUSH ADD_3 MSTORE_2 MSTORE_3 PUSH DUP2 PUSH ADD_1 MSTORE_4 PUSH ADD_0,0.0
26,0x0c9C2e9647f65118EffB3d87C6D025d95845E930_Rugpull_block374,20.0,30.57,True,False,-15,17,"['PUSH PUSH RETURNDATASIZE_0 ADD_0 AND_0 SWAP1 PUSH MLOAD_0 SWAP2 DUP3 ADD_2 PUSH MSTORE_0 RETURNDATASIZE_0 SWAP1 POP DUP2 ADD_1 PUSHTAG_0 SWAP2 SWAP2 SWAP2', 'PUSH PUSH RETURNDATASIZE_0 ADD_0 AND_0 SWAP1 PUSH MLOAD_0 SWAP2 DUP3 ADD_2 PUSH MSTORE_0 RETURNDATASIZE_0 SWAP1 POP DUP2 ADD_1 PUSHTAG_0 SWAP2 SWAP2 SWAP2', 'PUSHTAG_0 PUSH SWAP2 POP SWAP1 PUSH MLOAD_0 RETURNDATASIZE_0 DUP2 SWAP2 PUSH RETURNDATASIZE_0 ADD_0 SWAP1 SWAP4 AND_0 DUP4 ADD_2 PUSH MSTORE_0 ADD_1 SWAP1', 'POP PUSH PUSH SWAP1 MLOAD_0 SWAP1 RETURNDATASIZE_0 PUSH ADD_0 AND_0 DUP2 DUP1 RETURNDATASIZE_0 SWAP1 SWAP1 SWAP3 ADD_2 PUSH MSTORE_0 ADD_1 PUSHTAG_0 SWAP2', 'PUSH PUSHTAG_0 SWAP2 RETURNDATASIZE_0 SWAP1 POP ADD_0 PUSH MLOAD_0 PUSH DUP2 SWAP3 AND_0 ADD_2 SWAP2 SWAP2 PUSH MSTORE_0 RETURNDATASIZE_0 DUP2 ADD_1 SWAP1', 'POP PUSH PUSH SWAP1 MLOAD_0 DUP1 SWAP2 RETURNDATASIZE_0 PUSH ADD_0 AND_0 ADD_2 PUSH MSTORE_0 DUP1 RETURNDATASIZE_0 ADD_1 PUSHTAG_0 SWAP2 SWAP2 SWAP2 NOP', 'POP PUSH PUSH SWAP1 MLOAD_0 DUP1 SWAP2 RETURNDATASIZE_0 PUSH ADD_0 AND_0 ADD_2 PUSH MSTORE_0 DUP1 RETURNDATASIZE_0 ADD_1 PUSHTAG_0 SWAP2 NOP NOP NOP', 'POP PUSH MLOAD_0 RETURNDATASIZE_0 PUSH RETURNDATASIZE_0 DUP4 ADD_1 SWAP2 ADD_0 PUSH AND_0 DUP3 ADD_2 PUSH MSTORE_0 PUSHTAG_0 SWAP2 NOP NOP NOP NOP', 'POP PUSH MLOAD_0 DUP1 RETURNDATASIZE_0 PUSH ADD_0 PUSH AND_0 ADD_2 PUSH MSTORE_0 RETURNDATASIZE_0 DUP2 ADD_1 PUSHTAG_0 SWAP2 NOP NOP NOP NOP NOP', 'POP PUSH MLOAD_0 DUP1 RETURNDATASIZE_0 ADD_1 DUP2 PUSH RETURNDATASIZE_0 PUSH ADD_0 AND_0 ADD_2 PUSH MSTORE_0 PUSHTAG_0 SWAP2 NOP NOP NOP NOP NOP']","[0, 0, 0, 0, 0, 1, 3, 4, 5, 5]","[2.67, 2.67, 3.97, 4.22, 5.08, 7.21, 7.22, 7.93, 28.91, 30.48]",True,11.44,POP PUSH RETURNDATASIZE_0 PUSH ADD_0 AND_0 PUSH MLOAD_0 RETURNDATASIZE_0 DUP2 ADD_1 PUSHTAG_0 SWAP1 DUP3 SWAP4 SWAP1 SWAP2 SWAP4 ADD_2 PUSH MSTORE_0 SWAP1,0.0
27,0x1E77fbE7bfe9b11c75b90A76f571dca0C6D70a9a_ePORC_block217,50.0,114.24,True,False,-5,19,"['DUP9 PUSH AND_0 PUSH MSTORE_0 PUSH PUSH MSTORE_1 PUSH PUSH PUSH MSTORE_2 PUSH KECCAK256_0 PUSHTAG_0 SWAP2 DUP2 SSTORE_0 SLOAD_0 NOP NOP NOP NOP NOP NOP NOP NOP', 'DUP9 PUSH AND_0 PUSH MSTORE_0 PUSH PUSH MSTORE_1 PUSH PUSH PUSH MSTORE_2 PUSH KECCAK256_0 PUSHTAG_0 SWAP2 DUP2 SSTORE_0 SLOAD_0 NOP NOP NOP NOP NOP NOP NOP NOP']","[8, 8]","[10.57, 10.57]",False,50.02,,
28,0x1d29Bafa88E83a6D8F757DbFAf8BAf7be8fE08Bf_LoveVote_block236,60.0,87.32,True,False,-27,27,"['PUSH MLOAD_0 PUSH PUSH PUSH DUP4 MSTORE_0 DUP3 PUSH ADD_2 MSTORE_1 PUSH DUP3 ADD_3 MSTORE_2 PUSH PUSH PUSH DUP4 PUSH ADD_4 MSTORE_3 DUP3 ADD_1 MSTORE_4 PUSH ADD_0', 'PUSH MLOAD_0 PUSH PUSH PUSH DUP4 MSTORE_0 DUP3 PUSH ADD_2 MSTORE_1 PUSH DUP3 ADD_3 MSTORE_2 PUSH PUSH PUSH DUP4 PUSH ADD_4 MSTORE_3 DUP3 ADD_1 MSTORE_4 PUSH ADD_0', 'PUSH MLOAD_0 PUSH DUP2 MSTORE_0 PUSH PUSH DUP3 ADD_2 MSTORE_1 PUSH PUSH DUP3 ADD_3 MSTORE_2 PUSH PUSH DUP3 ADD_4 MSTORE_3 PUSH PUSH DUP3 ADD_1 MSTORE_4 PUSH ADD_0']","[0, 0, 0]","[55.93, 55.93, 59.98]",True,9.52,PUSH MLOAD_0 PUSH PUSH PUSH DUP4 ADD_2 PUSH DUP5 MSTORE_0 MSTORE_1 PUSH PUSH PUSH DUP5 ADD_3 MSTORE_2 DUP3 ADD_4 MSTORE_3 PUSH DUP2 PUSH ADD_1 MSTORE_4 PUSH ADD_0,0.0
29,0x3BfcE6D6F0d3D3f1326d86abdbe2845b4740Dc2E_MATICPAD_block1,60.0,90.56,True,False,-27,27,"['PUSH MLOAD_0 PUSH PUSH DUP3 ADD_2 PUSH DUP4 MSTORE_0 MSTORE_1 PUSH PUSH PUSH PUSH DUP5 ADD_3 MSTORE_2 DUP3 ADD_4 MSTORE_3 PUSH DUP2 PUSH ADD_1 MSTORE_4 PUSH ADD_0', 'PUSH MLOAD_0 PUSH PUSH DUP3 ADD_2 PUSH DUP4 MSTORE_0 MSTORE_1 PUSH PUSH PUSH PUSH DUP5 ADD_3 MSTORE_2 DUP3 ADD_4 MSTORE_3 PUSH DUP2 PUSH ADD_1 MSTORE_4 PUSH ADD_0', 'PUSH MLOAD_0 PUSH PUSH DUP3 ADD_2 PUSH DUP4 MSTORE_0 MSTORE_1 PUSH PUSH DUP3 ADD_4 PUSH DUP4 PUSH ADD_3 MSTORE_2 MSTORE_3 PUSH PUSH DUP3 ADD_1 MSTORE_4 PUSH ADD_0', 'PUSH MLOAD_0 PUSH PUSH DUP3 MSTORE_0 PUSH PUSH DUP4 ADD_2 MSTORE_1 PUSH DUP3 ADD_3 MSTORE_2 PUSH PUSH PUSH DUP4 PUSH ADD_4 MSTORE_3 DUP3 ADD_1 MSTORE_4 PUSH ADD_0']","[0, 0, 0, 0]","[52.42, 52.42, 86.61, 90.53]",True,12.04,PUSH MLOAD_0 PUSH PUSH PUSH DUP4 MSTORE_0 DUP3 PUSH ADD_2 MSTORE_1 DUP2 PUSH DUP2 PUSH ADD_3 MSTORE_2 PUSH ADD_4 MSTORE_3 PUSH PUSH PUSH DUP4 ADD_1 MSTORE_4 ADD_0,0.0
30,0x1d29Bafa88E83a6D8F757DbFAf8BAf7be8fE08Bf_LoveVote_block174,30.0,34.97,True,False,-4,22,"['CALLER_0 SWAP2 POP SWAP1 PUSH MSTORE_0 PUSH PUSH SWAP1 PUSH KECCAK256_0 PUSHTAG_0 SWAP1 PUSH SWAP1 ADD_0 SLOAD_0 NUMBER_0 SWAP1 PUSH PUSH MSTORE_1 NOP', 'CALLER_0 SWAP2 POP SWAP1 PUSH MSTORE_0 PUSH PUSH SWAP1 PUSH KECCAK256_0 PUSHTAG_0 SWAP1 PUSH SWAP1 ADD_0 SLOAD_0 NUMBER_0 SWAP1 PUSH PUSH MSTORE_1 NOP']","[1, 1]","[3.11, 3.11]",True,7.17,SWAP1 POP PUSH PUSH PUSH KECCAK256_0 PUSH PUSH CALLER_0 DUP3 MSTORE_0 PUSHTAG_0 SWAP4 PUSH SWAP3 POP MSTORE_1 ADD_0 SLOAD_0 SWAP1 NUMBER_0 PUSH SWAP3,0.0
31,0x3BfcE6D6F0d3D3f1326d86abdbe2845b4740Dc2E_MATICPAD_block99,50.0,58.05,True,False,-15,22,"['PUSH PUSH SWAP3 SWAP5 SWAP1 PUSH PUSH PUSH MSTORE_1 KECCAK256_0 DUP1 SWAP4 MSTORE_3 SWAP4 SWAP2 SLOAD_0 DUP3 PUSH DUP7 AND_0 PUSH MSTORE_0 DUP2 PUSH CALLER_0 SWAP1 MSTORE_2 LT_0 ISZERO_0', 'PUSH PUSH SWAP3 SWAP5 SWAP1 PUSH PUSH PUSH MSTORE_1 KECCAK256_0 DUP1 SWAP4 MSTORE_3 SWAP4 SWAP2 SLOAD_0 DUP3 PUSH DUP7 AND_0 PUSH MSTORE_0 DUP2 PUSH CALLER_0 SWAP1 MSTORE_2 LT_0 ISZERO_0', 'CALLER_0 PUSH PUSH KECCAK256_0 SWAP2 DUP5 DUP4 SWAP1 POP SLOAD_0 DUP5 DUP2 LT_0 PUSH PUSH MSTORE_1 ISZERO_0 SWAP2 SWAP4 PUSH MSTORE_3 SWAP2 DUP7 PUSH AND_0 PUSH MSTORE_0 PUSH MSTORE_2', 'PUSH PUSH MSTORE_1 PUSH PUSH KECCAK256_0 DUP1 PUSH MSTORE_3 SLOAD_0 DUP3 DUP2 LT_0 ISZERO_0 DUP6 PUSH AND_0 PUSH MSTORE_0 CALLER_0 PUSH MSTORE_2 NOP NOP NOP NOP NOP NOP NOP']","[0, 0, 0, 7]","[20.15, 20.15, 38.8, 44.93]",True,29.5,PUSH DUP5 PUSH AND_0 PUSH PUSH KECCAK256_0 DUP1 SLOAD_0 PUSH DUP5 MSTORE_1 DUP6 DUP2 LT_0 CALLER_0 SWAP1 ISZERO_0 SWAP5 SWAP1 SWAP3 SWAP1 MSTORE_3 SWAP3 SWAP2 PUSH MSTORE_0 PUSH MSTORE_2,0.0
32,0x3E873439949793e8c577E08629c36Ed8c184e7D9_welfare_block98,60.0,34.82,True,True,0,27,"['PUSH MLOAD_0 PUSH PUSH DUP3 ADD_4 PUSH PUSH DUP5 MSTORE_0 DUP4 PUSH ADD_2 MSTORE_1 PUSH DUP4 PUSH ADD_3 MSTORE_2 MSTORE_3 PUSH PUSH DUP3 PUSH ADD_1 MSTORE_4 ADD_0', 'PUSH MLOAD_0 PUSH PUSH DUP3 ADD_4 PUSH PUSH DUP5 MSTORE_0 DUP4 PUSH ADD_2 MSTORE_1 PUSH DUP4 PUSH ADD_3 MSTORE_2 MSTORE_3 PUSH PUSH DUP3 PUSH ADD_1 MSTORE_4 ADD_0', 'PUSH MLOAD_0 PUSH PUSH DUP3 PUSH ADD_2 PUSH DUP5 MSTORE_0 MSTORE_1 PUSH DUP3 ADD_1 PUSH DUP4 PUSH ADD_3 MSTORE_2 PUSH DUP4 PUSH ADD_4 MSTORE_3 MSTORE_4 PUSH ADD_0', 'PUSH MLOAD_0 PUSH PUSH PUSH DUP4 MSTORE_0 DUP3 ADD_3 PUSH DUP4 PUSH ADD_2 MSTORE_1 MSTORE_2 PUSH PUSH DUP3 ADD_4 MSTORE_3 PUSH DUP2 PUSH ADD_1 MSTORE_4 PUSH ADD_0']","[0, 0, 0, 0]","[26.72, 26.73, 32.58, 34.84]",True,11.53,PUSH MLOAD_0 PUSH DUP2 MSTORE_0 PUSH PUSH DUP3 ADD_2 MSTORE_1 PUSH PUSH DUP3 ADD_4 PUSH DUP4 PUSH ADD_3 MSTORE_2 MSTORE_3 PUSH PUSH DUP3 PUSH ADD_1 MSTORE_4 ADD_0,0.0
33,0x0c9C2e9647f65118EffB3d87C6D025d95845E930_ERC721_block86,60.0,52.33,True,True,0,27,"['PUSH MLOAD_0 PUSH DUP2 MSTORE_0 PUSH PUSH DUP3 ADD_4 PUSH PUSH DUP5 ADD_2 MSTORE_1 PUSH DUP4 PUSH ADD_3 MSTORE_2 MSTORE_3 PUSH PUSH DUP3 ADD_1 MSTORE_4 PUSH ADD_0', 'PUSH MLOAD_0 PUSH DUP2 MSTORE_0 PUSH PUSH DUP3 ADD_4 PUSH PUSH DUP5 ADD_2 MSTORE_1 PUSH DUP4 PUSH ADD_3 MSTORE_2 MSTORE_3 PUSH PUSH DUP3 ADD_1 MSTORE_4 PUSH ADD_0', 'PUSH MLOAD_0 PUSH DUP2 MSTORE_0 PUSH PUSH DUP3 ADD_2 MSTORE_1 PUSH PUSH PUSH DUP4 ADD_3 MSTORE_2 PUSH PUSH DUP4 PUSH ADD_4 MSTORE_3 DUP3 ADD_1 MSTORE_4 PUSH ADD_0', 'PUSH MLOAD_0 PUSH PUSH PUSH DUP4 ADD_2 PUSH DUP5 MSTORE_0 MSTORE_1 PUSH DUP3 ADD_3 MSTORE_2 PUSH DUP2 PUSH PUSH DUP5 ADD_4 MSTORE_3 PUSH ADD_1 MSTORE_4 PUSH ADD_0', 'PUSH MLOAD_0 PUSH PUSH PUSH DUP4 ADD_2 PUSH DUP5 MSTORE_0 MSTORE_1 PUSH DUP3 ADD_3 MSTORE_2 PUSH DUP2 PUSH PUSH DUP5 ADD_4 MSTORE_3 PUSH ADD_1 MSTORE_4 PUSH ADD_0']","[0, 0, 0, 0, 0]","[25.77, 25.78, 46.25, 52.29, 52.34]",True,8.55,PUSH MLOAD_0 PUSH PUSH PUSH PUSH DUP5 MSTORE_0 PUSH DUP5 ADD_2 MSTORE_1 DUP3 ADD_3 MSTORE_2 PUSH PUSH PUSH DUP4 PUSH ADD_4 MSTORE_3 DUP3 PUSH ADD_1 MSTORE_4 ADD_0,0.0
34,0x1E77fbE7bfe9b11c75b90A76f571dca0C6D70a9a_ePORC_block205,50.0,50.59,False,False,-2,28,[],[],[],False,50.02,,
35,0x3BfcE6D6F0d3D3f1326d86abdbe2845b4740Dc2E_MATICPAD_block145,40.0,36.1,True,True,0,19,"['PUSH PUSH MSTORE_1 PUSH PUSHTAG_0 DUP1 SWAP1 SWAP1 POP POP SWAP1 DUP5 DUP5 SWAP3 AND_0 PUSH MSTORE_0 PUSH PUSH KECCAK256_0 SSTORE_0 PUSH PUSH PUSHTAG_0 DUP6 PUSH SLOAD_0', 'PUSH PUSH MSTORE_1 PUSH PUSHTAG_0 DUP1 SWAP1 SWAP1 POP POP SWAP1 DUP5 DUP5 SWAP3 AND_0 PUSH MSTORE_0 PUSH PUSH KECCAK256_0 SSTORE_0 PUSH PUSH PUSHTAG_0 DUP6 PUSH SLOAD_0', 'PUSH PUSH PUSH DUP7 AND_0 DUP2 MSTORE_0 KECCAK256_0 SSTORE_0 PUSH PUSH PUSH SLOAD_0 SWAP2 MSTORE_1 PUSHTAG_0 PUSH DUP5 PUSH SWAP3 SWAP1 DUP7 SWAP5 NOP NOP NOP NOP', 'PUSH PUSH KECCAK256_0 SSTORE_0 PUSH PUSH PUSH MSTORE_1 DUP4 AND_0 PUSH MSTORE_0 DUP2 PUSH PUSH PUSHTAG_0 DUP4 DUP4 SLOAD_0 NOP NOP NOP NOP NOP NOP NOP NOP', 'PUSH PUSH KECCAK256_0 SSTORE_0 DUP2 PUSH PUSH MSTORE_1 PUSH PUSH PUSH DUP7 AND_0 DUP2 MSTORE_0 PUSHTAG_0 DUP4 DUP4 SLOAD_0 NOP NOP NOP NOP NOP NOP NOP NOP', 'PUSH PUSH KECCAK256_0 SSTORE_0 DUP3 PUSH AND_0 PUSH MSTORE_0 DUP2 PUSH PUSH MSTORE_1 PUSH PUSH PUSHTAG_0 DUP4 DUP4 SLOAD_0 NOP NOP NOP NOP NOP NOP NOP NOP', 'PUSH PUSH KECCAK256_0 SSTORE_0 DUP3 PUSH AND_0 PUSH MSTORE_0 DUP2 PUSH PUSH MSTORE_1 PUSH PUSH PUSHTAG_0 DUP4 DUP4 SLOAD_0 NOP NOP NOP NOP NOP NOP NOP NOP', 'PUSH PUSH KECCAK256_0 SSTORE_0 PUSH PUSH DUP5 AND_0 PUSH MSTORE_0 PUSH MSTORE_1 DUP2 PUSH PUSH PUSHTAG_0 DUP4 DUP4 SLOAD_0 NOP NOP NOP NOP NOP NOP NOP NOP', 'PUSH PUSH KECCAK256_0 SSTORE_0 PUSH PUSH PUSH MSTORE_1 DUP4 AND_0 PUSH MSTORE_0 DUP2 PUSH PUSH PUSHTAG_0 DUP4 DUP4 SLOAD_0 NOP NOP NOP NOP NOP NOP NOP NOP', 'PUSH PUSH KECCAK256_0 SSTORE_0 DUP2 DUP4 PUSH AND_0 PUSH MSTORE_0 PUSH PUSH PUSHTAG_0 PUSH PUSH MSTORE_1 DUP6 DUP4 SLOAD_0 NOP NOP NOP NOP NOP NOP NOP NOP']","[0, 0, 4, 8, 8, 8, 8, 8, 8, 8]","[14.69, 14.69, 15.38, 26.86, 26.93, 27.41, 27.45, 29.22, 29.24, 36.11]",True,27.87,PUSH PUSH KECCAK256_0 SSTORE_0 DUP2 PUSH PUSH SWAP1 PUSH DUP7 PUSH SLOAD_0 SWAP4 SWAP3 SWAP5 SWAP5 PUSH MSTORE_1 PUSH AND_0 DUP7 SWAP1 PUSH MSTORE_0 PUSHTAG_0 SWAP2 SWAP4,0.0
36,0x1f2cF791d940Bbb9fbe777271afa6ff9bBA8AbA0_ERC20_block67,60.0,52.08,True,True,0,27,"['PUSH MLOAD_0 PUSH PUSH DUP3 MSTORE_0 PUSH DUP3 ADD_2 MSTORE_1 PUSH PUSH DUP3 ADD_3 MSTORE_2 PUSH DUP2 PUSH ADD_4 MSTORE_3 PUSH DUP2 PUSH ADD_1 MSTORE_4 PUSH ADD_0', 'PUSH MLOAD_0 PUSH PUSH DUP3 MSTORE_0 PUSH DUP3 ADD_2 MSTORE_1 PUSH PUSH DUP3 ADD_3 MSTORE_2 PUSH DUP2 PUSH ADD_4 MSTORE_3 PUSH DUP2 PUSH ADD_1 MSTORE_4 PUSH ADD_0', 'PUSH MLOAD_0 PUSH DUP2 MSTORE_0 PUSH PUSH PUSH PUSH DUP5 ADD_2 MSTORE_1 PUSH DUP4 ADD_3 MSTORE_2 DUP2 PUSH ADD_4 MSTORE_3 PUSH PUSH DUP3 ADD_1 MSTORE_4 PUSH ADD_0', 'PUSH MLOAD_0 PUSH PUSH DUP3 MSTORE_0 PUSH DUP3 ADD_2 MSTORE_1 PUSH PUSH DUP3 PUSH ADD_3 MSTORE_2 PUSH DUP3 ADD_4 MSTORE_3 PUSH DUP2 PUSH ADD_1 MSTORE_4 PUSH ADD_0']","[0, 0, 0, 0]","[36.68, 36.68, 43.86, 52.09]",True,26.93,PUSH MLOAD_0 PUSH DUP2 PUSH ADD_2 PUSH DUP4 MSTORE_0 MSTORE_1 PUSH PUSH DUP3 ADD_3 MSTORE_2 PUSH PUSH PUSH DUP4 ADD_4 MSTORE_3 PUSH DUP3 PUSH ADD_1 MSTORE_4 ADD_0,0.0
37,0x3BfcE6D6F0d3D3f1326d86abdbe2845b4740Dc2E_MATICPAD_block125,60.0,50.42,True,True,0,27,"['PUSH MLOAD_0 PUSH PUSH DUP3 MSTORE_0 PUSH DUP3 ADD_3 PUSH PUSH DUP5 ADD_2 MSTORE_1 MSTORE_2 PUSH PUSH DUP3 ADD_4 MSTORE_3 PUSH PUSH DUP3 ADD_1 MSTORE_4 PUSH ADD_0', 'PUSH MLOAD_0 PUSH PUSH DUP3 MSTORE_0 PUSH DUP3 ADD_3 PUSH PUSH DUP5 ADD_2 MSTORE_1 MSTORE_2 PUSH PUSH DUP3 ADD_4 MSTORE_3 PUSH PUSH DUP3 ADD_1 MSTORE_4 PUSH ADD_0', 'PUSH MLOAD_0 PUSH PUSH DUP3 MSTORE_0 PUSH DUP3 ADD_3 PUSH PUSH DUP5 ADD_2 MSTORE_1 MSTORE_2 PUSH PUSH DUP3 ADD_4 MSTORE_3 PUSH PUSH DUP3 ADD_1 MSTORE_4 PUSH ADD_0', 'PUSH MLOAD_0 PUSH DUP2 MSTORE_0 PUSH PUSH DUP3 ADD_2 MSTORE_1 PUSH DUP1 DUP3 ADD_3 MSTORE_2 PUSH PUSH PUSH DUP4 PUSH ADD_4 MSTORE_3 DUP3 ADD_1 MSTORE_4 PUSH ADD_0']","[0, 0, 0, 0]","[24.74, 24.75, 24.77, 50.43]",True,10.52,PUSH MLOAD_0 PUSH PUSH DUP3 ADD_2 PUSH DUP4 MSTORE_0 MSTORE_1 PUSH PUSH PUSH DUP4 PUSH ADD_3 MSTORE_2 DUP3 ADD_1 PUSH DUP4 PUSH ADD_4 MSTORE_3 MSTORE_4 PUSH ADD_0,0.0
38,0x0c9C2e9647f65118EffB3d87C6D025d95845E930_Rugpull_block391,30.0,72.95,True,False,-12,19,"['SWAP1 PUSH PUSH MSTORE_1 POP PUSH DUP1 DUP4 PUSH PUSH SLOAD_1 SWAP4 KECCAK256_0 SWAP2 MSTORE_0 SLOAD_0 SWAP1 DUP3 LT_0 PUSH DUP4 PUSH SWAP3', 'SWAP1 PUSH PUSH MSTORE_1 POP PUSH DUP1 DUP4 PUSH PUSH SLOAD_1 SWAP4 KECCAK256_0 SWAP2 MSTORE_0 SLOAD_0 SWAP1 DUP3 LT_0 PUSH DUP4 PUSH SWAP3', 'SWAP1 POP PUSH SLOAD_1 PUSH SWAP1 DUP3 PUSH DUP6 PUSH MSTORE_0 PUSH PUSH KECCAK256_0 SLOAD_0 SWAP4 MSTORE_1 LT_0 DUP3 PUSH SWAP1 PUSH SWAP3', 'SWAP1 POP PUSH PUSH PUSH MSTORE_1 PUSH DUP4 DUP2 MSTORE_0 KECCAK256_0 SLOAD_0 PUSH PUSH DUP4 PUSH SLOAD_1 DUP2 LT_0 NOP NOP NOP NOP', 'PUSH PUSH MSTORE_1 SWAP1 POP PUSH PUSH KECCAK256_0 SLOAD_0 PUSH PUSH DUP5 PUSH MSTORE_0 DUP4 DUP2 SLOAD_1 DUP2 LT_0 NOP NOP NOP NOP']","[0, 0, 0, 4, 4]","[7.07, 7.08, 19.59, 24.37, 42.18]",True,9.97,PUSH PUSH PUSH PUSH PUSH MSTORE_1 DUP4 DUP7 SWAP6 POP SWAP5 DUP3 SWAP2 MSTORE_0 SLOAD_1 DUP5 LT_0 PUSH DUP4 KECCAK256_0 SLOAD_0 SWAP4 SWAP1,0.0
39,0x1f2cF791d940Bbb9fbe777271afa6ff9bBA8AbA0_ERC20_block65,60.0,71.08,True,False,-27,27,"['PUSH MLOAD_0 PUSH PUSH DUP3 MSTORE_0 PUSH PUSH DUP4 PUSH ADD_2 MSTORE_1 DUP3 ADD_3 MSTORE_2 PUSH DUP2 PUSH ADD_4 MSTORE_3 PUSH PUSH DUP3 PUSH ADD_1 MSTORE_4 ADD_0', 'PUSH MLOAD_0 PUSH PUSH DUP3 MSTORE_0 PUSH PUSH DUP4 PUSH ADD_2 MSTORE_1 DUP3 ADD_3 MSTORE_2 PUSH DUP2 PUSH ADD_4 MSTORE_3 PUSH PUSH DUP3 PUSH ADD_1 MSTORE_4 ADD_0', 'PUSH MLOAD_0 PUSH DUP2 PUSH ADD_3 PUSH DUP4 MSTORE_0 PUSH DUP4 PUSH ADD_2 MSTORE_1 MSTORE_2 PUSH PUSH DUP3 PUSH ADD_4 MSTORE_3 PUSH DUP3 PUSH ADD_1 MSTORE_4 ADD_0']","[0, 0, 0]","[37.92, 37.93, 57.15]",True,12.58,PUSH MLOAD_0 PUSH DUP2 PUSH ADD_2 PUSH DUP4 MSTORE_0 MSTORE_1 PUSH DUP2 PUSH DUP1 DUP3 ADD_3 MSTORE_2 PUSH ADD_1 PUSH PUSH DUP5 ADD_4 MSTORE_3 MSTORE_4 PUSH ADD_0,0.0
40,0x0c9C2e9647f65118EffB3d87C6D025d95845E930_ERC721_block109,60.0,41.28,True,True,0,27,"['PUSH MLOAD_0 PUSH PUSH DUP3 MSTORE_0 PUSH DUP3 PUSH ADD_2 MSTORE_1 DUP2 PUSH ADD_3 MSTORE_2 PUSH PUSH DUP3 ADD_4 MSTORE_3 PUSH PUSH DUP3 ADD_1 MSTORE_4 PUSH ADD_0', 'PUSH MLOAD_0 PUSH PUSH DUP3 MSTORE_0 PUSH DUP3 PUSH ADD_2 MSTORE_1 DUP2 PUSH ADD_3 MSTORE_2 PUSH PUSH DUP3 ADD_4 MSTORE_3 PUSH PUSH DUP3 ADD_1 MSTORE_4 PUSH ADD_0', 'PUSH MLOAD_0 PUSH PUSH DUP3 MSTORE_0 PUSH DUP3 PUSH ADD_2 MSTORE_1 PUSH DUP3 ADD_3 MSTORE_2 PUSH PUSH DUP3 ADD_1 PUSH DUP4 PUSH ADD_4 MSTORE_3 MSTORE_4 PUSH ADD_0', 'PUSH MLOAD_0 PUSH PUSH DUP3 MSTORE_0 PUSH DUP3 ADD_2 MSTORE_1 PUSH DUP2 PUSH ADD_3 MSTORE_2 PUSH PUSH DUP3 ADD_4 MSTORE_3 PUSH PUSH PUSH DUP4 ADD_1 MSTORE_4 ADD_0']","[0, 0, 0, 0]","[25.7, 25.71, 28.24, 41.29]",True,16.16,PUSH MLOAD_0 PUSH DUP2 PUSH ADD_2 PUSH DUP4 MSTORE_0 MSTORE_1 PUSH PUSH DUP3 ADD_3 MSTORE_2 PUSH PUSH DUP3 ADD_4 MSTORE_3 PUSH DUP2 PUSH ADD_1 MSTORE_4 PUSH ADD_0,0.0
41,0x3E873439949793e8c577E08629c36Ed8c184e7D9_Ownable_block19,60.0,64.52,True,False,-27,27,"['PUSH MLOAD_0 PUSH PUSH DUP3 ADD_3 PUSH DUP4 MSTORE_0 PUSH DUP4 PUSH ADD_2 MSTORE_1 MSTORE_2 PUSH PUSH DUP3 ADD_4 MSTORE_3 PUSH DUP2 PUSH ADD_1 MSTORE_4 PUSH ADD_0', 'PUSH MLOAD_0 PUSH PUSH DUP3 ADD_3 PUSH DUP4 MSTORE_0 PUSH DUP4 PUSH ADD_2 MSTORE_1 MSTORE_2 PUSH PUSH DUP3 ADD_4 MSTORE_3 PUSH DUP2 PUSH ADD_1 MSTORE_4 PUSH ADD_0', 'PUSH MLOAD_0 PUSH DUP2 MSTORE_0 PUSH PUSH DUP3 ADD_2 MSTORE_1 PUSH DUP2 PUSH ADD_4 PUSH DUP4 PUSH ADD_3 MSTORE_2 MSTORE_3 PUSH DUP2 PUSH ADD_1 MSTORE_4 PUSH ADD_0', 'PUSH MLOAD_0 PUSH DUP2 MSTORE_0 PUSH PUSH DUP3 ADD_2 MSTORE_1 PUSH DUP2 PUSH ADD_4 PUSH DUP4 PUSH ADD_3 MSTORE_2 MSTORE_3 PUSH DUP2 PUSH ADD_1 MSTORE_4 PUSH ADD_0']","[0, 0, 0, 0]","[41.44, 41.45, 49.35, 49.38]",True,11.6,PUSH MLOAD_0 PUSH DUP2 MSTORE_0 PUSH DUP2 PUSH ADD_2 MSTORE_1 PUSH PUSH PUSH PUSH DUP5 ADD_3 MSTORE_2 DUP3 ADD_1 PUSH PUSH DUP5 ADD_4 MSTORE_3 MSTORE_4 PUSH ADD_0,0.0
42,0x1E77fbE7bfe9b11c75b90A76f571dca0C6D70a9a_ePORC_block128,60.0,61.39,True,False,-27,27,"['PUSH MLOAD_0 PUSH PUSH DUP3 ADD_2 PUSH DUP4 MSTORE_0 MSTORE_1 PUSH PUSH PUSH PUSH DUP5 ADD_3 MSTORE_2 DUP3 ADD_4 MSTORE_3 PUSH PUSH DUP3 ADD_1 MSTORE_4 PUSH ADD_0', 'PUSH MLOAD_0 PUSH PUSH DUP3 ADD_2 PUSH DUP4 MSTORE_0 MSTORE_1 PUSH PUSH PUSH PUSH DUP5 ADD_3 MSTORE_2 DUP3 ADD_4 MSTORE_3 PUSH PUSH DUP3 ADD_1 MSTORE_4 PUSH ADD_0', 'PUSH MLOAD_0 PUSH PUSH PUSH DUP4 MSTORE_0 DUP3 ADD_2 MSTORE_1 PUSH PUSH DUP3 ADD_3 MSTORE_2 PUSH PUSH DUP3 ADD_4 MSTORE_3 PUSH PUSH DUP3 ADD_1 MSTORE_4 PUSH ADD_0', 'PUSH MLOAD_0 PUSH PUSH PUSH DUP4 MSTORE_0 DUP3 ADD_2 MSTORE_1 PUSH PUSH DUP3 ADD_3 MSTORE_2 PUSH PUSH DUP3 ADD_4 MSTORE_3 PUSH PUSH DUP3 ADD_1 MSTORE_4 PUSH ADD_0']","[0, 0, 0, 0]","[35.89, 35.9, 61.34, 61.36]",True,20.62,PUSH MLOAD_0 PUSH DUP2 PUSH DUP2 MSTORE_0 PUSH ADD_2 MSTORE_1 PUSH PUSH DUP3 ADD_4 PUSH DUP4 PUSH ADD_3 MSTORE_2 MSTORE_3 PUSH PUSH DUP3 ADD_1 MSTORE_4 PUSH ADD_0,0.0
