,block_id,solver_time_in_sec,has_model,finished_execution,lower_bound,upper_bound,models_found,cost_per_model_found,found_model_times,z3_time_in_sec,z3_is_model_found,z3_found_model,z3_cost_foundz3_time_in_sec,hard_is_sat,hard_time_in_sec,hard_found_model,hard_cost_found
0,0x1d29Bafa88E83a6D8F757DbFAf8BAf7be8fE08Bf_LoveVote_block245,62.07,True,False,-24,24,"['DUP2 PUSH MLOAD_0 DUP1 PUSH ADD_0 PUSH MSTORE_0 PUSHTAG_1 PUSH PUSH PUSH DUP5 MSTORE_1 SWAP2 PUSH PUSH DUP6 ADD_1 MSTORE_2 AND_1 SWAP1 SWAP3 PUSH AND_0 PUSHTAG_0 SWAP3 DUP6 SWAP2 SWAP3', 'DUP2 PUSH MLOAD_0 DUP1 PUSH ADD_0 PUSH MSTORE_0 PUSHTAG_1 PUSH PUSH PUSH DUP5 MSTORE_1 SWAP2 PUSH PUSH DUP6 ADD_1 MSTORE_2 AND_1 SWAP1 SWAP3 PUSH AND_0 PUSHTAG_0 SWAP3 DUP6 SWAP2 SWAP3', 'PUSH PUSHTAG_0 PUSH DUP4 DUP6 PUSH AND_0 PUSH MLOAD_0 DUP1 DUP5 ADD_0 SWAP1 SWAP2 SWAP4 POP PUSH MSTORE_0 DUP1 PUSH DUP3 MSTORE_1 PUSH ADD_1 PUSH SWAP1 MSTORE_2 PUSHTAG_1 PUSH AND_1', 'PUSH MLOAD_0 DUP1 PUSH ADD_0 PUSH MSTORE_0 PUSH DUP2 MSTORE_1 PUSH PUSHTAG_1 AND_1 PUSH DUP5 AND_0 DUP4 PUSH PUSH DUP6 ADD_1 MSTORE_2 PUSH SWAP4 PUSHTAG_0 SWAP4 NOP NOP NOP NOP', 'PUSH PUSHTAG_0 DUP4 PUSH AND_0 DUP4 PUSH MLOAD_0 PUSH DUP2 ADD_0 PUSH MSTORE_0 PUSH DUP2 MSTORE_1 PUSH PUSH DUP3 ADD_1 MSTORE_2 PUSH PUSHTAG_1 AND_1 NOP NOP NOP NOP NOP NOP', 'PUSH PUSHTAG_0 DUP4 PUSH AND_0 DUP4 PUSH MLOAD_0 PUSH DUP2 ADD_0 PUSH MSTORE_0 PUSH DUP2 MSTORE_1 PUSH PUSH DUP3 ADD_1 MSTORE_2 PUSH PUSHTAG_1 AND_1 NOP NOP NOP NOP NOP NOP', 'PUSH PUSHTAG_0 DUP4 PUSH AND_0 DUP4 PUSH MLOAD_0 PUSH DUP2 ADD_0 PUSH MSTORE_0 PUSH DUP2 MSTORE_1 PUSH PUSH DUP3 ADD_1 MSTORE_2 PUSH PUSHTAG_1 AND_1 NOP NOP NOP NOP NOP NOP', 'PUSH PUSHTAG_0 PUSH DUP5 AND_0 DUP4 PUSH MLOAD_0 DUP1 PUSH ADD_0 PUSH MSTORE_0 PUSH DUP2 MSTORE_1 PUSH DUP2 PUSH ADD_1 MSTORE_2 PUSH PUSHTAG_1 AND_1 NOP NOP NOP NOP NOP NOP', 'PUSH PUSHTAG_0 DUP4 PUSH AND_0 DUP4 PUSH MLOAD_0 DUP1 PUSH ADD_0 PUSH MSTORE_0 PUSH DUP2 MSTORE_1 PUSH PUSH DUP3 ADD_1 MSTORE_2 PUSHTAG_1 PUSH AND_1 NOP NOP NOP NOP NOP NOP', 'PUSH PUSHTAG_0 DUP4 PUSH AND_0 DUP4 PUSH MLOAD_0 DUP1 PUSH ADD_0 PUSH MSTORE_0 PUSH DUP2 MSTORE_1 PUSH PUSH DUP3 ADD_1 MSTORE_2 PUSHTAG_1 PUSH AND_1 NOP NOP NOP NOP NOP NOP']","[0, 0, 0, 4, 6, 6, 6, 6, 6, 6]","[12.76, 12.77, 32.8, 39.97, 61.13, 61.16, 61.18, 61.23, 61.72, 61.74]","[12.76, 39.97, 61.13]","[False, False, False]","['No solution', 'No solution', 'No solution']",,sat,23.27,DUP1 PUSH PUSH PUSH PUSH DUP7 AND_0 SWAP2 MLOAD_0 PUSHTAG_1 SWAP5 SWAP2 PUSH SWAP6 AND_1 PUSHTAG_0 SWAP5 DUP3 ADD_0 PUSH MSTORE_0 PUSH DUP3 MSTORE_1 DUP2 PUSH ADD_1 PUSH SWAP1 MSTORE_2,0
1,0x0c9C2e9647f65118EffB3d87C6D025d95845E930_ERC721_block115,53.94,False,False,-2,30,[],[],[],,,,,sat,45.23,DUP2 DUP2 PUSH PUSH MSTORE_1 PUSH SWAP1 PUSH SWAP4 PUSH SWAP2 POP POP SWAP1 PUSH DUP9 AND_0 SWAP3 AND_2 DUP2 MSTORE_0 MSTORE_2 PUSH KECCAK256_0 DUP1 PUSH MSTORE_3 SLOAD_0 PUSH AND_1,0
2,0x0c9C2e9647f65118EffB3d87C6D025d95845E930_ERC721_initial_block40,8.32,True,True,0,12,"['PUSH DUP7 ADD_0 MLOAD_0 SWAP3 POP SWAP4 POP DUP1 DUP3 GT_0 ISZERO_0', 'PUSH DUP7 ADD_0 MLOAD_0 SWAP3 POP SWAP4 POP DUP1 DUP3 GT_0 ISZERO_0', 'SWAP4 PUSH DUP7 ADD_0 MLOAD_0 SWAP3 POP POP DUP1 DUP3 GT_0 ISZERO_0', 'PUSH DUP7 ADD_0 MLOAD_0 SWAP3 POP SWAP4 POP DUP1 DUP3 GT_0 ISZERO_0', 'SWAP4 POP DUP1 PUSH DUP7 ADD_0 MLOAD_0 SWAP3 POP DUP3 GT_0 ISZERO_0']","[0, 0, 0, 0, 0]","[1.73, 1.73, 2.06, 7.96, 8.34]",[1.73],[False],['No solution'],,sat,4.49,DUP6 PUSH ADD_0 MLOAD_0 SWAP3 POP SWAP4 POP DUP1 DUP3 GT_0 ISZERO_0,0
3,0x1E77fbE7bfe9b11c75b90A76f571dca0C6D70a9a_ePORC_block100,83.54,True,False,-7,23,"['PUSH PUSHTAG_1 PUSH CALLER_0 PUSH MSTORE_0 PUSH PUSH SWAP1 DUP7 AND_0 DUP5 MSTORE_2 PUSH PUSH MSTORE_1 KECCAK256_0 DUP5 DUP2 PUSH MSTORE_3 PUSHTAG_0 CALLER_0 SWAP3 SLOAD_0 NOP NOP NOP NOP NOP NOP NOP NOP', 'PUSH PUSHTAG_1 PUSH CALLER_0 PUSH MSTORE_0 PUSH PUSH SWAP1 DUP7 AND_0 DUP5 MSTORE_2 PUSH PUSH MSTORE_1 KECCAK256_0 DUP5 DUP2 PUSH MSTORE_3 PUSHTAG_0 CALLER_0 SWAP3 SLOAD_0 NOP NOP NOP NOP NOP NOP NOP NOP', 'PUSH PUSH PUSH KECCAK256_0 PUSH PUSH MSTORE_1 DUP1 PUSH DUP6 PUSH CALLER_0 PUSH MSTORE_0 AND_0 DUP5 MSTORE_2 MSTORE_3 SLOAD_0 CALLER_0 DUP5 PUSHTAG_0 PUSHTAG_1 SWAP4 NOP NOP NOP NOP NOP NOP NOP NOP NOP', 'PUSH PUSH PUSH PUSH CALLER_0 PUSH DUP8 AND_0 SWAP4 MSTORE_0 MSTORE_1 PUSH MSTORE_2 PUSHTAG_1 CALLER_0 DUP5 PUSHTAG_0 PUSH DUP6 KECCAK256_0 DUP1 PUSH MSTORE_3 SLOAD_0 NOP NOP NOP NOP NOP NOP NOP NOP NOP', 'PUSH DUP3 PUSH AND_0 CALLER_0 DUP3 MSTORE_0 PUSH MSTORE_2 PUSHTAG_1 PUSH DUP3 KECCAK256_0 DUP1 PUSH PUSH PUSH MSTORE_1 MSTORE_3 SLOAD_0 DUP5 PUSHTAG_0 CALLER_0 SWAP3 NOP NOP NOP NOP NOP NOP NOP NOP NOP', 'PUSH DUP3 PUSH AND_0 CALLER_0 DUP3 MSTORE_0 PUSH MSTORE_2 PUSHTAG_1 PUSH DUP3 KECCAK256_0 DUP1 PUSH PUSH PUSH MSTORE_1 MSTORE_3 SLOAD_0 DUP5 PUSHTAG_0 CALLER_0 SWAP3 NOP NOP NOP NOP NOP NOP NOP NOP NOP', 'PUSH PUSH PUSH MSTORE_1 DUP3 AND_0 CALLER_0 PUSH MSTORE_0 PUSH MSTORE_2 PUSH PUSHTAG_1 CALLER_0 DUP5 PUSHTAG_0 PUSH PUSH KECCAK256_0 DUP1 PUSH MSTORE_3 SLOAD_0 NOP NOP NOP NOP NOP NOP NOP NOP NOP NOP', 'PUSH PUSHTAG_1 CALLER_0 DUP5 PUSHTAG_0 PUSH PUSH MSTORE_1 PUSH DUP6 KECCAK256_0 DUP4 DUP7 MSTORE_0 DUP1 PUSH MSTORE_3 SLOAD_0 PUSH DUP4 AND_0 DUP7 MSTORE_2 NOP NOP NOP NOP NOP NOP NOP NOP NOP NOP', 'PUSH PUSH PUSH MSTORE_1 CALLER_0 DUP2 MSTORE_0 PUSHTAG_1 CALLER_0 DUP5 PUSHTAG_0 PUSH DUP6 KECCAK256_0 DUP1 PUSH MSTORE_3 SLOAD_0 PUSH DUP4 AND_0 DUP7 MSTORE_2 NOP NOP NOP NOP NOP NOP NOP NOP NOP NOP', 'PUSH DUP3 AND_0 CALLER_0 PUSH MSTORE_0 PUSH PUSH MSTORE_1 PUSH MSTORE_2 PUSH PUSHTAG_1 CALLER_0 DUP5 PUSHTAG_0 PUSH DUP6 KECCAK256_0 DUP1 PUSH MSTORE_3 SLOAD_0 NOP NOP NOP NOP NOP NOP NOP NOP NOP NOP']","[8, 8, 9, 9, 9, 9, 10, 10, 10, 10]","[16.1, 16.1, 51.2, 56.45, 64.8, 64.83, 67.36, 70.47, 81.45, 83.15]","[16.1, 51.2, 67.36]","[False, False, True]","['No solution', 'No solution', 'PUSH PUSH PUSH PUSH KECCAK256_0 PUSH PUSH MSTORE_1 DUP1 PUSH MSTORE_3 DUP1 CALLER_0 DUP7 PUSHTAG_1 SWAP5 AND_0 SWAP1 DUP1 SWAP4 SLOAD_0 SWAP6 MSTORE_0 SWAP1 DUP7 SWAP2 PUSH MSTORE_2 POP SWAP5 PUSHTAG_0 PUSH SWAP5']",,sat,39.04,PUSH CALLER_0 PUSH PUSH PUSH KECCAK256_0 DUP6 PUSH AND_0 DUP1 SWAP2 DUP5 DUP2 SWAP3 POP SWAP1 SLOAD_0 SWAP5 PUSH SWAP1 SWAP5 MSTORE_1 PUSH MSTORE_0 PUSH SWAP5 MSTORE_3 PUSH MSTORE_2 DUP5 PUSHTAG_0 PUSHTAG_1 SWAP4,0
4,0x1f2cF791d940Bbb9fbe777271afa6ff9bBA8AbA0_ERC20_block51,50.68,False,False,-2,29,[],[],[],,,,,sat,38.24,PUSH PUSH PUSH PUSH PUSH MSTORE_1 KECCAK256_0 PUSH PUSH DUP8 AND_0 DUP3 SLOAD_0 DUP2 SWAP1 SWAP5 SWAP1 POP CALLER_0 SWAP2 SWAP1 MSTORE_0 PUSH MSTORE_2 MSTORE_3 DUP3 DUP2 LT_0 ISZERO_0,0
5,0x0c9C2e9647f65118EffB3d87C6D025d95845E930_Rugpull_block318,51.09,False,False,-3,30,[],[],[],,,,,sat,45.3,PUSH PUSH PUSH PUSH SWAP1 MSTORE_1 DUP4 PUSH AND_2 DUP2 SWAP2 SWAP4 POP SWAP3 SWAP2 PUSH DUP9 AND_0 SWAP3 KECCAK256_0 DUP1 SLOAD_0 SWAP4 PUSH MSTORE_0 PUSH MSTORE_3 MSTORE_2 PUSH AND_1,0
